[
  {
    "article_id": "L6/fiktiva/north-bylaws/art-3",
    "topics": [],
    "actors": [],
    "actions": [],
    "constraint_kinds": [],
    "always_for_dps": [],
    "topic_ban": false
  },
  {
    "article_id": "L6/fiktiva/north-bylaws/art-9",
    "topics": [],
    "actors": [],
    "actions": [],
    "constraint_kinds": [],
    "always_for_dps": [],
    "topic_ban": false
  }
]
