[
  {
    "article_id": "L3/fiktiva/constitution/art-12",
    "topics": [],
    "actors": [],
    "actions": [],
    "constraint_kinds": [],
    "always_for_dps": [],
    "topic_ban": false
  },
  {
    "article_id": "L3/fiktiva/constitution/art-7",
    "topics": [],
    "actors": [],
    "actions": [],
    "constraint_kinds": [],
    "always_for_dps": [],
    "topic_ban": false
  }
]
