[
  {
    "article_id": "L2/fiktiva/union/art-4",
    "topics": [],
    "actors": [],
    "actions": [],
    "constraint_kinds": [],
    "always_for_dps": [],
    "topic_ban": false
  },
  {
    "article_id": "L2/fiktiva/union/art-9",
    "topics": [],
    "actors": [],
    "actions": [],
    "constraint_kinds": [],
    "always_for_dps": [],
    "topic_ban": false
  }
]
